Title,URLs,Categories
"Anaplan zum Anfassen – mit Woodmark",https://www.anaplan.com/de/events/anaplan-zum-anfassen-connected-planning-mit-anaplan-und-woodmark/,
"Anaplan für Ihre Personalplanung",https://www.anaplan.com/de/resource/papers/anaplan-fur-ihre-personalplanung/,
"Anaplan für Ihre S&#038;OP Prozesse",https://www.anaplan.com/de/resource/papers/anaplan-fur-ihre-sop-prozesse/,
"Tata Steel vernetzt Vertrieb und Supply Chain",https://www.anaplan.com/de/customers/tata-steel/,
"Anaplan for Sales",https://www.anaplan.com/de/resources/papers/anaplan-for-sales/,
"Optimierung in Vertrieb und Forecasting dank Anaplan",https://www.anaplan.com/de/customers/stepstone-german/,
"Deloitte FP&#038;A",https://www.anaplan.com/de/webinars/deloitte-fpa/,
"RSA verkürzt den FP&#038;A-Prozess um volle 4 Monate",https://www.anaplan.com/de/customers/rsa-group/,
"Anaplan wurde als „Leader“ in Gartners SCPM MQ bewertet.",https://www.anaplan.com/de/papers/anaplan-named-a-scpm-leader-by-gartner/,
"BARC Planning Survey 2017",https://www.anaplan.com/de/resource/papers/barc-planning-survey-2017/,
"Ihr ROI beim Kauf einer Planungslösung",https://www.anaplan.com/de/resources/papers/forrester-tei/,
"Leader im Bereich Sales Performance Management",https://www.anaplan.com/de/resources/papers/de-gartner-spm-mq/,
"KPIs in 30 Minuten statt in einer Woche.",https://www.anaplan.com/de/resources/case-studies/legal-and-general/,
"Corporate Tax Reporting",https://www.anaplan.com/de/corporate-tax-reporting/,
"Statistical forecasting",https://www.anaplan.com/de/statistical-forecasting/,
"Barc survey infographic",https://www.anaplan.com/de/resources/papers/barc-survey-infographic/,
"Anaplan S&#038;OP Planning",https://www.anaplan.com/de/resources/papers/anaplan-sop-planning-datasheet/,
"Wie entscheidend ist die Absatzplanung für Ihren Vertriebserfolg?",https://www.anaplan.com/de/resources/papers/sales-infographic/,
"HR Datasheet",https://www.anaplan.com/de/resources/datasheets/hr-datasheet/,
"Anaplan für Ihre Marketingplanung",https://www.anaplan.com/de/resources/datasheets/marketing-resource-management/,
"Wie steigern Sie die Effektivität Ihres Vertriebes?",https://www.anaplan.com/de/resources/papers/high-performance-sales/,
Accorhotels,https://www.anaplan.com/de/resources/case-studies/accorhotels/,
"Anaplan: Die Plattform für intelligente Unternehmen",https://www.anaplan.com/de/resources/papers/mint-jutras-report/,
"Der neue Spielplan zur strategischen Planung",https://www.anaplan.com/de/resources/papers/hbr-report/,
"Welche Vorteile bringen moderne Cloud-Lösungen mit sich?",https://www.anaplan.com/de/resources/papers/fsn-on-premise/,
"Anaplans Cloud-Plattform erzielt Bestnoten bei Forrester",https://www.anaplan.com/de/resources/papers/forrester-report/,
"Die Technologie hinter der Cloud-Plattform",https://www.anaplan.com/de/resources/papers/disruptive-technology/,
"Wie optimieren Sie die Anreizvergütung Ihrer Vertriebsmannschaft?",https://www.anaplan.com/de/resources/papers/cso-report-incentive-comp/,
"Die Vorteile von Anaplans Cloud-Plattform für die Planung in Unternehmen",https://www.anaplan.com/de/resources/papers/anaplan-platform/,
"7 Gründe für die Wahl von Anaplan (und nicht Excel).",https://www.anaplan.com/de/resources/papers/7-reasons/,
"Eine vollautomatisierte Finanzlösung für ein Container-Terminal",https://www.anaplan.com/de/resources/case-studies/rwg-case-study/,
"Weltweite Neustrukturierung der regionalen Vertriebs- und Quotenplanung.",https://www.anaplan.com/de/resources/case-studies/hp-case-study/,
"Verbesserung der finanziellen und operativen Ergebnisse – Dank Anaplan.",https://www.anaplan.com/de/resources/case-studies/brussels-airlines-case-study/,
